{"artifacts":[{"path":"staging/gen-2f00eedc3657f21edc4d1ab7946cb3f0604914b7c65316cb90ee4942923e0ced/source_012a2b8ce2a51c94_d93fdb9ea7dd5e70.scl","sha256":"d93fdb9ea7dd5e706198306eb9f3cba03fd8a40c2c5e943506279fd0ce521622"},{"path":"staging/gen-2f00eedc3657f21edc4d1ab7946cb3f0604914b7c65316cb90ee4942923e0ced/source_77ff5b987fa60a35_b8b9d8e882673e40.scl","sha256":"b8b9d8e882673e402b62741408543e061a923c8893a28fa0471a1fd6899dd1fd"},{"path":"staging/gen-2f00eedc3657f21edc4d1ab7946cb3f0604914b7c65316cb90ee4942923e0ced/source_d1ad0a2b2c69a490_ff49389c9954aac5.scl","sha256":"ff49389c9954aac5c04004a7a0eff6e54dedf6d5f6bafaef3386e7b6c2a771e2"},{"path":"staging/gen-2f00eedc3657f21edc4d1ab7946cb3f0604914b7c65316cb90ee4942923e0ced/source_e8b997ff5726bfc7_6f1518bd85e70809.scl","sha256":"6f1518bd85e708090d8b378c22473f0fea355c075c85c63172e99060681681b3"}],"conflicts":[],"machineHash":"sha256:0b67c202d8c2b2dfc05949397bc3c4abd32ced66530cab8c21f3ece06d90d431","observed":{"PLC1":{"objectKeys":[],"sourceNames":[]}},"package":{"hash":"sha256:88ca55995a53b5a413dec63144c72b6fe082b86d39dccec2ee616a443f719ca9","id":"fixture.planning","version":"1.0.0"},"phases":["project","hardware","network","plcStructure","plcTypes","plcLibrary","plcProgram","plcTags","alarms","hmi","compile","cleanup","save","record"],"planHash":"sha256:55affb061b2771223e871bfcb41caca55c42534186f3affd12f59e1c4568f6ff","planId":"gen-2f00eedc3657f21edc4d1ab7946cb3f0604914b7c65316cb90ee4942923e0ced","schema":"tiamcp.plan/1","selfCheck":{"errors":0,"warnings":0},"skipped":[{"key":"PLC1/device/PLC1","reason":"exists-identical"}],"steps":[{"argumentDigest":"sha256:c690a6721b1aa9c9ede1d0036955cdb69ed1b2d4d759d0d76e4717532c46933a","arguments":{"confirm":true,"dryRun":false,"filePath":"C:/tiamcp-generation/staging/gen-2f00eedc3657f21edc4d1ab7946cb3f0604914b7c65316cb90ee4942923e0ced/source_e8b997ff5726bfc7_6f1518bd85e70809.scl","groupPath":"","softwarePath":"PLC1"},"availability":{"behaviorPolicy":"current","native":"NOT RUN","tool":"present"},"dependsOn":[],"expect":{"contains":"source_e8b997ff5726bfc7_6f1518bd85e70809.scl","fingerprint":"sha256:f56666f067822d6272a57f30e3a9d9f0453f6bf72a05999603ef6689278854f8","readback":"ListPlcExternalSources"},"id":"s00001","key":"PLC1/externalSource/source_e8b997ff5726bfc7_6f1518bd85e70809.scl","op":"create","phase":"plcLibrary","review":{"effect":{"sourcesAdded":["source_e8b997ff5726bfc7_6f1518bd85e70809.scl"]},"expect":{"byteCount":148,"filePath":"C:/tiamcp-generation/staging/gen-2f00eedc3657f21edc4d1ab7946cb3f0604914b7c65316cb90ee4942923e0ced/source_e8b997ff5726bfc7_6f1518bd85e70809.scl","groupPath":"","inputSha256":"6f1518bd85e708090d8b378c22473f0fea355c075c85c63172e99060681681b3","softwarePath":"PLC1","sourceName":"source_e8b997ff5726bfc7_6f1518bd85e70809.scl","sourcesBefore":"observed+run"},"forbid":{"sourcesBefore":["source_e8b997ff5726bfc7_6f1518bd85e70809.scl"]},"lateArguments":["expectedPlanHash"],"mode":"tool-preview","rule":"external-source-import/1","witness":{"planHash":"sha256"}},"tool":"ImportPlcExternalSource"},{"argumentDigest":"sha256:e86115e522d480dc4a58ad97549d736b1c0bc1ebcb72014644c6defef0edc8f7","arguments":{"confirm":true,"dryRun":false,"externalSourceName":"source_e8b997ff5726bfc7_6f1518bd85e70809.scl","softwarePath":"PLC1"},"availability":{"behaviorPolicy":"current","native":"NOT RUN","tool":"present"},"dependsOn":["s00001"],"expect":{"contains":"FB_Motor","fingerprint":"sha256:1ccf7e74dcfff6a85ceddab617b4976913a540c7dd7cdcc4b74b080ac5f094d7","readback":"ListPlcBlocks"},"id":"s00002","key":"PLC1/block/FB_Motor","op":"create","phase":"plcLibrary","review":{"effect":{"generated":["block:FB_Motor"],"others":"forbidden"},"expect":{"generationOption":"None","groupPath":"","objectKeysBefore":"observed+run","resultBasis":"native-returned-objects-with-path-readback","softwarePath":"PLC1","sourceName":{"fact":"s00001.sourceName"}},"forbid":{"objectKeysBefore":["block:FB_Motor"]},"lateArguments":["expectedPlanHash"],"mode":"tool-preview","rule":"external-source-generate/1","witness":{"objectsBefore.isConsistent":"ignore","objectsBefore.modifiedDate":"ignore","objectsBefore.programmingLanguage":"ignore","objectsBefore.typeName":"ignore","planHash":"sha256","sourceIdentity":"capture-as-fact"}},"tool":"GenerateBlocksFromExternalSource"},{"argumentDigest":"sha256:a310812622352eb7356c86756c9a03de4d902f2427f39ad569f6dc676241774d","arguments":{"confirm":true,"dryRun":false,"filePath":"C:/tiamcp-generation/staging/gen-2f00eedc3657f21edc4d1ab7946cb3f0604914b7c65316cb90ee4942923e0ced/source_012a2b8ce2a51c94_d93fdb9ea7dd5e70.scl","groupPath":"","softwarePath":"PLC1"},"availability":{"behaviorPolicy":"current","native":"NOT RUN","tool":"present"},"dependsOn":[],"expect":{"contains":"source_012a2b8ce2a51c94_d93fdb9ea7dd5e70.scl","fingerprint":"sha256:19645ef29ea064610163a53a79c28a45a8c9b1ab23123fa841bf6e23e6d93dea","readback":"ListPlcExternalSources"},"id":"s00003","key":"PLC1/externalSource/source_012a2b8ce2a51c94_d93fdb9ea7dd5e70.scl","op":"create","phase":"plcProgram","review":{"effect":{"sourcesAdded":["source_012a2b8ce2a51c94_d93fdb9ea7dd5e70.scl"]},"expect":{"byteCount":101,"filePath":"C:/tiamcp-generation/staging/gen-2f00eedc3657f21edc4d1ab7946cb3f0604914b7c65316cb90ee4942923e0ced/source_012a2b8ce2a51c94_d93fdb9ea7dd5e70.scl","groupPath":"","inputSha256":"d93fdb9ea7dd5e706198306eb9f3cba03fd8a40c2c5e943506279fd0ce521622","softwarePath":"PLC1","sourceName":"source_012a2b8ce2a51c94_d93fdb9ea7dd5e70.scl","sourcesBefore":"observed+run"},"forbid":{"sourcesBefore":["source_012a2b8ce2a51c94_d93fdb9ea7dd5e70.scl"]},"lateArguments":["expectedPlanHash"],"mode":"tool-preview","rule":"external-source-import/1","witness":{"planHash":"sha256"}},"tool":"ImportPlcExternalSource"},{"argumentDigest":"sha256:6fb6eedf01260666abf112a1928a1f12cfa73f72918b7ab9c69ec4b20b947dee","arguments":{"confirm":true,"dryRun":false,"externalSourceName":"source_012a2b8ce2a51c94_d93fdb9ea7dd5e70.scl","softwarePath":"PLC1"},"availability":{"behaviorPolicy":"current","native":"NOT RUN","tool":"present"},"dependsOn":["s00002","s00003"],"expect":{"contains":"IDB_M01","fingerprint":"sha256:facbb6c4cf71c728115b8160a8b259943dcb56e934fa12f4f9a6aedffeb1b5f7","readback":"ListPlcBlocks"},"id":"s00004","key":"PLC1/block/IDB_M01","op":"create","phase":"plcProgram","review":{"effect":{"generated":["block:IDB_M01"],"others":"forbidden"},"expect":{"generationOption":"None","groupPath":"","objectKeysBefore":"observed+run","resultBasis":"native-returned-objects-with-path-readback","softwarePath":"PLC1","sourceName":{"fact":"s00003.sourceName"}},"forbid":{"objectKeysBefore":["block:IDB_M01"]},"lateArguments":["expectedPlanHash"],"mode":"tool-preview","rule":"external-source-generate/1","witness":{"objectsBefore.isConsistent":"ignore","objectsBefore.modifiedDate":"ignore","objectsBefore.programmingLanguage":"ignore","objectsBefore.typeName":"ignore","planHash":"sha256","sourceIdentity":"capture-as-fact"}},"tool":"GenerateBlocksFromExternalSource"},{"argumentDigest":"sha256:5b267433de534582d5139aafd9499b37ba7d7137482fc01c9a848836e6e6cade","arguments":{"confirm":true,"dryRun":false,"filePath":"C:/tiamcp-generation/staging/gen-2f00eedc3657f21edc4d1ab7946cb3f0604914b7c65316cb90ee4942923e0ced/source_d1ad0a2b2c69a490_ff49389c9954aac5.scl","groupPath":"","softwarePath":"PLC1"},"availability":{"behaviorPolicy":"current","native":"NOT RUN","tool":"present"},"dependsOn":[],"expect":{"contains":"source_d1ad0a2b2c69a490_ff49389c9954aac5.scl","fingerprint":"sha256:d311a4cfdb9e1ac6ef09534fe09b18c6edd117a16809f4a8b9c3dd675af01411","readback":"ListPlcExternalSources"},"id":"s00005","key":"PLC1/externalSource/source_d1ad0a2b2c69a490_ff49389c9954aac5.scl","op":"create","phase":"plcProgram","review":{"effect":{"sourcesAdded":["source_d1ad0a2b2c69a490_ff49389c9954aac5.scl"]},"expect":{"byteCount":101,"filePath":"C:/tiamcp-generation/staging/gen-2f00eedc3657f21edc4d1ab7946cb3f0604914b7c65316cb90ee4942923e0ced/source_d1ad0a2b2c69a490_ff49389c9954aac5.scl","groupPath":"","inputSha256":"ff49389c9954aac5c04004a7a0eff6e54dedf6d5f6bafaef3386e7b6c2a771e2","softwarePath":"PLC1","sourceName":"source_d1ad0a2b2c69a490_ff49389c9954aac5.scl","sourcesBefore":"observed+run"},"forbid":{"sourcesBefore":["source_d1ad0a2b2c69a490_ff49389c9954aac5.scl"]},"lateArguments":["expectedPlanHash"],"mode":"tool-preview","rule":"external-source-import/1","witness":{"planHash":"sha256"}},"tool":"ImportPlcExternalSource"},{"argumentDigest":"sha256:1af18a02b8f327d81246a8e4a1f646b776b4310c36063da33c40d43ac94ae3c9","arguments":{"confirm":true,"dryRun":false,"externalSourceName":"source_d1ad0a2b2c69a490_ff49389c9954aac5.scl","softwarePath":"PLC1"},"availability":{"behaviorPolicy":"current","native":"NOT RUN","tool":"present"},"dependsOn":["s00002","s00005"],"expect":{"contains":"IDB_M02","fingerprint":"sha256:14ac400ff46f806cfde5aff839e9a95056b45953fb06ef4ddd6432d153957da7","readback":"ListPlcBlocks"},"id":"s00006","key":"PLC1/block/IDB_M02","op":"create","phase":"plcProgram","review":{"effect":{"generated":["block:IDB_M02"],"others":"forbidden"},"expect":{"generationOption":"None","groupPath":"","objectKeysBefore":"observed+run","resultBasis":"native-returned-objects-with-path-readback","softwarePath":"PLC1","sourceName":{"fact":"s00005.sourceName"}},"forbid":{"objectKeysBefore":["block:IDB_M02"]},"lateArguments":["expectedPlanHash"],"mode":"tool-preview","rule":"external-source-generate/1","witness":{"objectsBefore.isConsistent":"ignore","objectsBefore.modifiedDate":"ignore","objectsBefore.programmingLanguage":"ignore","objectsBefore.typeName":"ignore","planHash":"sha256","sourceIdentity":"capture-as-fact"}},"tool":"GenerateBlocksFromExternalSource"},{"argumentDigest":"sha256:f8a70897db42f8ab1401635a0fb0368e7b3a12808f9cb5d79f235433e45add21","arguments":{"confirm":true,"dryRun":false,"filePath":"C:/tiamcp-generation/staging/gen-2f00eedc3657f21edc4d1ab7946cb3f0604914b7c65316cb90ee4942923e0ced/source_77ff5b987fa60a35_b8b9d8e882673e40.scl","g